id,url,freq,review,name,latitude,longitude
19323446,https://www.zomato.com/ncr/irfan-bhai-vasant-kunj-new-delhi,1,"I tried Irfan Bhai few days back, & I haven’t had a better feast before honestly. Commendable packaging, on time delivery, amazing burst of flavours. I tried the bhindi ka salan first time & I have fallen in love with the dish tasted absolutely yummy with the Taftan. The dahi kebab is also another dish which I will highly recommend soft, every bite melts in your mouth leaving behind a great burst of flavours. Must try this place don’t forget to try the Shahide Jam ( one of the best gulab Jamun).",Irfan Bhai,28.5206000000,77.1647000000
19280557,https://www.zomato.com/ncr/sandoz-nehru-place-new-delhi,1,"This place serves some amazing food, the best part is that they are taking initiative to fight corona. I loved the quick & prompt service, the staff was very courteous. Must must try the chicken Malai tikka, Palak patta Chaat. For the mains I would highly recommend the Butter Chicken, with butter Naan along with Dal Makhani & Navrattan Korma.

This place is fabulous, you must try with your family.",Sandoz,28.5496180000,77.2498300000
18233593,https://www.zomato.com/ncr/farzi-cafe-connaught-place-new-delhi,1,"I tried farzi first time & I loved it. The service, was very good.. I would highly recommend this place for a great experience. Must try the Galouti burger, dal chawal arancini, lamb shanks in desi ghee Nihari with Naan. The experience at Farzi was exceptionally well can’t wait to be back..",Farzi Cafe,28.6324804801,77.2211901471
19291541,https://www.zomato.com/ncr/mic-drop-south-extension-2-new-delhi,1,"Ambiance : Two floors seating cafe with light decorations and live music on the rooftop. Beautiful neon quotes written on the wall.

Food :
Dahi ke kebab : The filling was nice and the kebabs were covered in charcoal.
Paneer kebab : They had dry fruit fillings in them and tasted a little on the sweeter side.
Dragon spring rolls : Amazing in taste with cheese inside.
Chilli veg dimsums : Spicy and very nice flavours.
Chicken dimsums : These were also good.
Pizza : Thin crust pizza with a good amount of toppings.
Chocolate Fondant : Heaven in mouth. This is the best choco lava cake I've ever had. A must try

Service: On time service.",MIC Drop,28.5679993058,77.2241794690
19062617,https://www.zomato.com/ncr/xero-degrees-vijay-nagar-new-delhi,1,"Ambiance : Pretty cafe with light decorations and live music

Food :
Peri peri cheese fries : Lipsmacking cheese and mayonnaise topped on peri peri fries. Amazing in taste
Pizza in a jar : A light form of a pizza and a must try.
Mini burger sliders : These are cute little burgers which taste amazing.
Exotic garlic bread : Garlic bread topped with veggies and cheese.
Green apple cooler : The presentation is just amazing and tastes good too.
Nutella oreo freak shake : The best shake ever. Topped with a lot of cream and oreos, this shake is very thick and heavy.

Service: On time service.",Xero Degrees,28.6948024973,77.2037691996
18277179,https://www.zomato.com/ncr/yum-yum-cha-dlf-cyber-city-gurgaon,1,"Amazing place always a fabulous experience. Love the service the food everything is great.. must try chicken chilli oil, butter garlic prawn, rocky road, chilli cheese.",Yum Yum Cha,28.4944567284,77.0878263563
19283556,https://www.zomato.com/ncr/ophelia-the-ashok-chanakyapuri-new-delhi,1,"#Newintown Ophelia, the newly opened restaurant and bar in The Ashok, Chanakyapuri that serves Turkish and European food. Classy & Top Notch decor with absolutely fabulous food & drinks. . . Hamlet, an iconic play written by William Shakespeare outlines a character named 'Ophelia,' a young and beautiful woman who was deeply loved by everyone.... She is associated with flowers, which is perhaps the inspiration for this restaurant. . Non-Veg Mezze Platter was absolutely stunning had several different types of dips, including the traditional hummus, carrot tartare, chickpea with yoghurt, tahini and muhammara. Some Grilled fish , Lamb Adana, Chicken Cheese Adana along with Turkish life &...read more",Ophelia - The Ashok,28.5956736761,77.1967847273
18372695,https://www.zomato.com/ncr/united-coffee-house-rewind-sector-18-noida,1,"Ambiance : Spacious cafe with a separate bar area. Food : 1. Spring rolls : Amazing in taste. A must try. 2. Cheesy Garlic bread : It was big in size and was soft. 3. Singapore sizzler : Tried the cottage cheese singapore sizzler. The vegetables were well cooked and were served with noodles. 4. Brownie kafe : The whipped cream was very light and very rich in taste. The coffee was good too. 5. Cold coffee with ice cream : Ice cream was superb. This coffee is for people who love black coffee. 6. Gulab jamun : Served with pista ice cream, this dish is a heaven for your taste buds. This is quite good in quantity and can be shared among 3 people. 7. Brownie with ice cream : Brownie was a...read more",United Coffee House Rewind,28.5676721643,77.3213129863
19234693,https://www.zomato.com/ncr/the-kimono-club-chanakyapuri-new-delhi,1,"The kimono club from the makers of whiskey samba and wine company, it a elegant fine dine place, serving some great food and drinks. I tried the eat Dimsum lunch which has a huge range of salads, soups, Dimsum, bao, cheung fun,congee & desserts. I totally loved the Veg chilli wonton, kake and spinach Dimsum, the smoked corn soup was absolutely delicious and can’t be missed.. my favourite amongst the sushi was the veg tempura roll & the California roll. I totally loved the Asparagus Congee. The meal ended on a sweet note with hazelnut chocolate pancakes. The best part about this place is that you can simply press the button and call for champagne butler who will prepared a cocktail in...read more",The Kimono Club,28.5841969846,77.1904812008
19313721,https://www.zomato.com/ncr/beyond-designs-bistro-mg-road-new-delhi,1,"I recently tried this beautiful place, few days back.. The place is fantastic, and we tried some the signature dishes like the Sumac Flowered foxtail millet breakfast pilaf on beetroot hash, this preparation was so exotic with very good flavours, must try by vegetarians.. Next for the starters I tried the water chestnut chilli oil, fried water chestnut tossed in mild veggies was a perfect starter to kick start the meal.. I totally recommend she’ll pasta & wild mushroom & truffle oil orzo.. You can totally check out this place to enjoy a fab meal & a great cup of coffee with your friends",Beyond Designs Bistro,28.4962865628,77.1551943943
7765,https://www.zomato.com/ncr/vega-pure-vegetarian-hotel-alka-classic-connaught-place-new-delhi,1,"Vega Resturant in Hotel Alka Classic is a pure vegetarian restaurant which is located on the ground floor of the hotel & prepares food without the use of onion and garlic. Yes , you read that right , its arduous to find such places these days but Vega is a legacy restaurant which preserves the recipes and maintains the taste of their dishes. The interiors maintains the innovation with antique décor and adds to its charm. I started with their Chilly paneer in which spice was adequately balanced and definitely one of the best I’ve had in a while. Next , I ordered their Kebab Platter which had hara bhara kebab , dahi ke sholay , dahi ke kebab and each item was flavourful & tender ....read more",Vega Pure Vegetarian - Hotel Alka Classic,28.6324831285,77.2163658589
19265887,https://www.zomato.com/ncr/verandah-handcrafted-malviya-nagar-new-delhi,1,"So I recently tried Verandah Handcrafted, they have a huge range of options to choose from.. my personal favourite were, 1) Achari Panner Tikka - Huge pieces of Panner marinated in Indian species and perfectly grilled, love the flavours as they were quite balanced. One of the best achari Panner tikka I have had.. 2) Vada Pav - Initially I was reluctant to order this but to my surprise the taste was fabulous, the best part was that the bada remained crisp loved the packaging.. 3) Mumbai Mutton Dhaba Ghost - must try if you love mutton preparation, this is is perfect bliss during winters 4) Makhani Panner - classic Indian dish which can never go wrong.. 5) Seasonal Vegetable Cream -...read more",Verandah Handcrafted,28.5345110000,77.2145250000
19257149,https://www.zomato.com/ncr/fabcafe-by-fabindia-sector-110-noida,1,"Fabcafe is one of my favourite places in town.. which has opened it’s door in Noida.. I recently went the hospitality was spectacular staff was courteous.. I ordered for Veg wheat momos with generous filing and they are one of the best Dimsum with dip.. also I loved the guilt free Golgappa which are best when you want to munch on the very classic and Delhiites favourite golgappas..
for the mains I just love the Kathal biryani which is one of the best and highly recommended.. i also love the six grain Paratha & Saag panner..I love this place you must must try this place..",Fabcafe By Fabindia,28.5419720000,77.3700000000
799,https://www.zomato.com/ncr/gulati-pandara-road-new-delhi,1,"Recently I was at the iconic Gulati Restaurant Pandara road with my friends. I ordered for the vegetarian platter which consisted of Dahi Kebab which were absolutely delicious you must try it out I also tried the bharwa Aloo & Panner Ghilafi which were yum.. for mains we ordered the classic butter chicken, dal Makhani, Sarso ka saag and maki roti.. the meal was fabulous you must try the dal Makhani, butter chicken along with paratha.. To end the meal we ordered gulab Jamun & moong dal Halwa",Gulati,28.6079824068,77.2300457954
18332048,https://www.zomato.com/ncr/nandos-sector-18-noida,1,"I started my meal with Cheesy Festa fries ( loaded with fresh chilli, cheese sauce & parsley amazing start to the meal along with Madeira red a fizzy drink perfect accompaniment to the fries.. The best part is that everything at Nando’s is prepared fresh & served steaming hot.. I also order chicken wings tender chicken wings, with spicy peri peri flavour perfect for the chilli winters.. I totally loved the Creamy cashew Chicken naan loaded with cashew nut and tomato sauce topped with mozzarella, onions.. loved this preparation.. to end my meal I ordered the chocolate cake which was soft and moist chocolate loaded with chocolate chips.. loved everything about this iconic...read more",Nando's,28.5673244097,77.3210752755
19078918,https://www.zomato.com/ncr/oishii-wok-dlf-phase-4-gurgaon,1,"I recently tried out this outlet when I was in gurgaon. I ordered Oishii Burnt Garlic Fish, which by names seems to be something unique and worth giving a try to! The flavours in this were very good! It was perfectly cooked, the pieces of fish were soft and were melting in mouth. The gravy will go perfect with rice if you like that combo. Also, the packaging was perfectly done avoiding the leakage. It was overall a perfect thing to have!",Oishii Wok,28.4614350000,77.0886000000
18738703,https://www.zomato.com/ncr/cafe-diaries-satyaniketan-new-delhi,1,"Cafe diaries located in south campus, is a very popular place amongst college students.. I happen to visit this place with my friends and I totally love the vibe and ambiance of this place.. The place has a wide wide range of variety to choose from. I tried the chicken sliders which were really flavourful and a perfect dish to munch on.. I also tried the pinwheel which one of the most loved item on the menu, the taste was nice.. I totally loved and recommend the cheese baked fries & cheese baked pasta which is served with garlic bread and baked to perfection.. My absolute favourite dish was the grilled chicken in harissa sauce.. it was one of the best grilled chicken I have had perfect...read more",Cafe Diaries,28.5878897167,77.1672331542
19265141,https://www.zomato.com/ncr/big-bang-city-janpath-new-delhi,1,"Big Bang city initially Bunta bar has totally revamped with a great ambiance and a huge range of food to choose from.. I happen to visit this place with my friends totally loved it.. must try the butter chicken platter the butter chicken was really good & creamy.. I also tried the chicken fajita tacos which were really fresh served with salsa & sour cream.. must try the chicken Dimsum they also tasted really yum..

This place is a must try to spend time with friends & family..",Big Bang City,28.6283634822,77.2197514772
18424903,https://www.zomato.com/ncr/andreas-eatery-saket-new-delhi,1,"Andrea’s Eatery is one of my favourite places in select city walk,  perfect place for some lip smacking food !! Its a best place to hangout with friends and family  Apart from the signature pizza and pasta which are amazing, you should definitely try out the Asparagus & mushroom cigars, filled with goodness of  cheese served with chilli dip perfect combination, another  favourite not to be missed  is trio bruschetta.. The toppings are so fresh & exotic. On my last visit i tried From the farm and it happens to be one of my favourite dishes from now o.. it was too goof haven't had a better one before. spinach ricotta wrapped in zucchini cannelloni seven with sauce...   I ended my...read more",Andrea's Eatery,28.5283807044,77.2185203433
18377917,https://www.zomato.com/ncr/the-tummy-section-south-city-2-gurgaon,1,"One of the best shawarma i have had.. I have been to yummy section many times and this place never disappoints. On my recent visit I tried the crunchy momos, topped with mayo, chilli sauce & Tandoori sauce they were fabulous super crispy, loaded with sauces & generous filling... another favourite is creamy chicken lollipops literally dipped in cream & and absolute delight.. must try this place if you love quick service & yummy food",The Tummy Section,28.4218807503,77.0525992289
18548374,https://www.zomato.com/ncr/mirza-greater-kailash-gk-1-new-delhi,1,"I recently tried this place and tried these yummy dishes
1) Dudiya kebab
2) Irani Tandoori chicken
3) Panner lucknowi
4) dal e Awadh
5) Phirni
Honestly everything tasted so good, the Kebabs we’re so super soft, well prepared. Tandoori chicken had great flavours.. totally loved the Panner Lucknowi best you can’t miss...

Loved this place must try !!",Mirza,28.5562933000,77.2375506000
18671714,https://www.zomato.com/ncr/olly-olives-all-day-cafe-bar-dlf-cyber-city-gurgaon,1,"Olly is one of the most beautiful places in Cyberhub. They have a huge outdoor and indoor seating. The food looks absolutely stunning and tasted great. Must try the veggies Pizza it was loaded with cheese & fresh veggies, best part was that the crust was perfect and flavours were great. Next thing which you shouldn’t miss is the Burrito Bowl it was so flavourful with right amount of portions, absolutely great dish, presented super well.. The perfect ending was the French toast with fresh mangoes, blueberries & chocolate with a hot cup of coffee, fabulous meal... definitely my favourite at cyberhub...",OLLY - Olive's All Day Cafe & Bar,28.4945860849,77.0883316174
19012596,https://www.zomato.com/ncr/one8-commune-aerocity-new-delhi,1,"Another amazing restaurant which has opened its doors in world mark, by the man himself Virat Kohli. This place is absolutely beautifully made with an elaborate menu designed by chef Pawan. If I talk about the food I absolutely loved the Chicken soft shell tacos, Mock meat tikka ( veg) it was so flavourful and tasted amazing, loved the chicken tikka napoleon Pizza, Minu chicken slider tasted absolutely delicious, would highly recommend Cheese and Spinach Puff and ended my fabulous mean with the 5 layers chocolate cafe which was one of the best desserts I have had recently. Must try this fabulous place.",One8 Commune,28.5515370000,77.1227040000
19034769,https://www.zomato.com/ncr/milkshake-and-co-kailash-colony-new-delhi,1,"A very famous brand for some thick shakes, and snacks has finally opened its doors in Delhi. It’s a perfect place to chill with friends and loved ones. They have a huge variety of shakes, burgers, fries. I totally loved the god father shake which is a chocolate based drink it was super thick and creamy. Must try the chicken deluxe burger with some chicken fries. All in all this place is worth a try I’m sure you won’t be disappointed.",Milkshake and Co.,28.5526396377,77.2419494390
19098798,https://www.zomato.com/ncr/coffee-bond-saket-new-delhi,1,"This place is excellent, if you want to have a fabulous time over some coffee and light snacks. I totally loved the wide range of fresh coffee they prepare. Loved the pesto chicken sandwich, thin crust veggies pizza, pesto sauce pasta and white sauce spaghetti was amazing full of flavours and was presented very well. Must try this cute little co working / cafe.",Coffee Bond,28.5170831556,77.1978978440
1632,https://www.zomato.com/ncr/amar-jyoti-sarojini-nagar-new-delhi,1,"Amazing food 😍😍 if you are around this place don’t miss this eatery. Must try tawa seekh, garlic paratha ( absolutely great ) keema kaleji, chicken curry. Loved my whole experience.",Amar Jyoti,28.5764899058,77.1966499463
19100266,https://www.zomato.com/ncr/kake-da-hotel-1-preet-vihar-new-delhi,1,"Kake da hotel, is an amazing place when you want have a great meal with your family. You will find a huge menu to choose from, the food is prepared fresh service is quick and staff is courteous. I tried Panner Tak tak, which was the best vegetarian dish I had with paratha, I also tried dal makhni, saag meat ( classic dish you can’t miss at kake da hotel ) you must try this place for an amazing time.",Kake Da Hotel,28.6419536701,77.2961461544
305240,https://www.zomato.com/ncr/the-chatter-house-nehru-place-new-delhi,1,"If you are looking for a place to chill with your friends, this place should be on your list. Totally loved the interiors, they have indoor and outdoor seating.

Must try chocolate shake, cold coffee, don’t miss the woodfire pizza, cheesy fries, non veg platter, for mains you can have chicken tikka Masala, I ended my meal with chocolate brownie and ice cream it was just yum

Had a fabulous time :)",The Chatter House,28.5516315618,77.2519832477
19022694,https://www.zomato.com/ncr/ampm-caf%C3%A9-bar-dlf-cyber-city-gurgaon,1,"This place should be on your list if you love to spend time with your friends. The place has An amazing vibe with a very comfortable sitting and great options for food and drinks.

Must try chilli chicken preparation was just yum, juicy chicken burger totally loved the heavenly patty and burger with fries, also try the Dimsum I’m sure it will be great. veggies loaded pizza can never go wrong 😍😍😍 also don’t forget the dal Makhani shots with butter Naan. End your meal with super comforting churros with Nutella and Ferrero rocher Kulfi",AMPM Café & Bar,28.4939929296,77.0885656402
19165382,https://www.zomato.com/ncr/witc-wok-in-the-clouds-connaught-place-new-delhi,1,"Wok in clouds, is one of the best places if you want to chill with your family and friends. With beautiful interiors, courteous staff and quick service this place has to be on your list.

In food you must try
1) Tandoori Pomfret
2)Fried chicken wings
3) Crunchy dahi kebab
4)chicken chettinad
5)watermelon feta salad

I absolutely loved everything I had, the dishes were demolished in minutes by me and my friends. The place is fantastic also they serve some great cocktails so check this place out !!",WITC-Wok In The Clouds,28.6343252782,77.2202158347
18441798,https://www.zomato.com/ncr/uncultured-cafe-bar-kailash-colony-new-delhi,1,"Uncultured is one of the most happening places in Kailash colony, It has two floors with very comfortable indoor and outdoor sitting, totally love the whole vibe of this place.

Must try non veg platter mutton seekh & malai tikka were fabulous, loved the pepper chicken roll chicken was cream and wrapped up in lute tawa ka paratha, it was yum. (must try ) I also loved the chicken dims & grilled chicken with peri peri sauce.

Must try this place for some great time with friends.",Uncultured Cafe & Bar,28.5525774983,77.2414106503
19129306,https://www.zomato.com/ncr/yeti-the-himalayan-kitchen-connaught-place-new-delhi,1,"If you want to have some great  Bhutanese/Tibbetan /Nepalese food in Delhi, one of the best places in town is YETI. Yeti has anew address in Cp .The beautiful interiors give you a feel of some north eastern place, seating is huge, staff is courteous & the atmosphere is very welcoimg. . In food I started with Aloo Momos. These are best momos i have had with creamy and generous potato filling and the taste was amazing.. I tried the chicken momos also they were super juicy and tasted amazing with the dips.. I also tried Ema Datchi, if you are a cheese lover like me you can't miss this !!! .I also tried chicken dry fry & was was sadeko they were also amazing.  In desserts i had Yomari...read more",Yeti - The Himalayan Kitchen,28.6340860360,77.2192737088
18552969,https://www.zomato.com/ncr/juggernaut-kailash-colony-new-delhi,1,"If you love good vegetarian food and are a die hard fan of South Indian food you can’t miss this place. It’s the best special mention to Mr Shyam who always serves and his team great work. Love the masala Dosa, nariayal ladoo, onion rava Masala, Crispy Vada, and soft idli & the veg uttapam with filter coffee can never go wrong.

Great experience",Juggernaut,28.5528811268,77.2408631444
18594464,https://www.zomato.com/ncr/curry-up-noww-sector-72-noida,1,"I want to try this outlet in Noida since a long time after watching their tempting pics collection on Instagram.
Amazing looking combos. So Today was the day i ordered food from here. This Outlet is hearty enough to serve as the full meal for lunch or dinner, and has tons of flavor. I tried their mix veg , Daal and butter naan. Super amazing.
Good job people. Doing amazing work.",Curry Up Noww,28.5644846164,77.3830245808
18375422,https://www.zomato.com/ncr/nukkad-cafe-bar-sda-new-delhi,1,"With a beautiful open seating, life music and so comforting ambience this place should be on your list to visit with your friends and loved ones. They have a huge menu of drinks and food to choose from. Since it’s monsoon In town I started with a cup of hot tea along with Palak patta chaat and cheese nachos the combination was deadly and recommend you to try the Palak patta chaat. I also tried chilly chicken momos which were a little spicy for me but the taste was nice. I also tried the chicken tikka roomali roll which I loved it if you love Lebanese food you should must try the hummus, chicken shush taouk with garlic naan the whole platter was so fresh and tasted amazing loved the...read more",Nukkad Cafe & Bar,28.5470036539,77.1969248727
18034050,https://www.zomato.com/ncr/elation-greater-kailash-gk-1-new-delhi,1,"Few days back visitors this place with my friends and the experience was great !! I tried Tandoori veg momos the filling was quite generous and the momos were well done and tasted amazing with the dip. I also tried the thick kitkat shake. I also tried Pizza fries ( new addition ), crusty garlic cheese toast they were quite yum as cheese is something we all love. I also tried the jalapeños cheese popper loaded with mozzarella and cheddar cheese served with dip are also something you should miss at all. For mains I tried the gobhi adarki achari along with paratha I ended my meal with fried ice cream which was superb !!",Elation,28.5494542851,77.2366208956
18455933,https://www.zomato.com/ncr/the-hong-kong-club-andaz-delhi-aerocity-new-delhi,1,"Hongkong club is one of the best places if you are looking to spend time with your special one it’s a kind of club located in Andaz Aerocity. The place is quite attractive they have a huge bar with a very warm sitting. The place is known for some great food and zodiac cocktails. Things I ordered - 🍱Prawn Dimsum - soft and perfectly done Dimsum with amazing prawn filling.( must have) 🍱Classic Barbeque Chicken bao - looked so beautiful and tasted heavenly. 🍱Battered Tiger prawns curry leaves and burnt garlic- heaven for prawn lovers it’s just amazing and can’t be defined in words 🍱 Ice bowl banana, blueberry, salted caramel ice cream - YOU JUST CAN’T MISS THIS...read more",The Hong Kong Club - Andaz Delhi,28.5549028000,77.1223142000
19064144,https://www.zomato.com/ncr/biryani-bros-sector-81-faridabad,1,"Another amazing place if your are drooling for some tasty biryani and north Indian food is biryani bros,they have some delicious biryani specially there chicken biryani.The place not on offers some biryani but also other non- veg as well as veg dishes like there dal makhani was very creamy and had a amazingly delicious smoky flavour which I really loved about it. Plus the Delivery was on time and I really liked there packaging. So all the faridabad people do try the biryani bros 👍",Biryani Bros,28.3927005035,77.3404213786
18555387,https://www.zomato.com/ncr/friction-the-drinkery-sector-29-gurgaon,1,"Friction is amazing place to chill with friends for some amazing food and drinks in sectors 29. The have amazing interiors and ambience which makes it look fabulous.
In food you must try duo panner, chicken shawarma skewers ( highly recommended ), butter chicken sliders ( a great fusion dish with creamy butter chicken which was amazing and recommended. ) They also have a huge range of Pizza and pasta to choose from. For the mains you can never go wrong with butter chicken, jeera aloowith Naan.
The service was great.",Friction The Drinkery,28.4681702068,77.0623105019
