id,url,freq,review,name,latitude,longitude
18718210,https://www.zomato.com/ncr/zabardast-zaffran-green-park-new-delhi,1,"A good place to satisfy you some irresistible Indian food cravings. The dishes I would highly recommend Tandoori Chicken, the quantity was super fulfilling and the taste was delicious also. Next was seekh kebabs would highly recommend this one you can’t just miss this. Panner tikka a vegetarian delight also tastes quite yum tender juicy big huge chunks of cottage cheese were well done. Not to miss the chicken biryani, butter chicken and dal makhani classic combination can never ever go wrong.

In all good experience.",Zabardast Zaffran,28.5572390272,77.2048823163
18289240,https://www.zomato.com/NehruPlaceSocial,1,"Social Nehru Place, is one of my favourite places to go be it a hectic weekday or some fun weekends social is the place to be. The menu for food and drinks are wide. My favourites include breakfast trays, some lip smacking Dimsums, the dilli 6 Chaat Platter is just you can’t miss. The kebab platter which has some assorted kebabs paired well with drinks for a night out with friends. The huge selection of Liiit, cocktails , shakes, ice teas, along with some finger food like cheesy fries, spicy wings,the Chinese boxes, Biryani are also you can’t miss. For desserts you must try Ramesh Suresh, Chocolate chutzpah, layer cake. Social is one of my favourites places in Delhi for...read more",Nehru Place Social,28.5514572164,77.2514183074
3697,https://www.zomato.com/ncr/royal-china-nehru-place-new-delhi,1,"The place is serving some lip smacking food since many years now, the view from 16th floor is spectacular. The place has a really good vibe, a perfect place to grab a fine dine meal.

Would highly recommend the dumplings chicken & chive, chicken wontons, spring rolls, spinach n cheese dumpling . For mains must try king pap chicken with noodles. Caramel custard, chocolate mud cake perfect to end the meal.",Royal China,28.5502135245,77.2512245178
18550176,https://www.zomato.com/ncr/ni-hao-radisson-noida-sector-55-noida,1,"Ni Hao, Asian Speciality Restaurant In Radisson Noida. The place has very beautiful fine dine ambiance, courteous staff & the menu is brilliantly curated with authentic flavour.
Best part is the live kitchen, where chefs prepare some flavourful dishes.
I tried some of the chefs special Dimsum basket totally loved chicken Sui Mai, smoked chicken, mushroom & Bol Choy, for starters prawns in coriander & basil sauce.
For mains would recommend tofu clay pot, Kung pao chicken, fish in oyster sauce along with noodles.

In desserts HIGHLY RECOMMEND, FRIED ICE CREAM one of the best I have had in town. You can’t miss this.

Totally worth it highly recommend for great food.",Ni Hao - Radisson Noida,28.6041529167,77.3506399244
18703737,https://www.zomato.com/ncr/handiwala-2-shahpur-jat-new-delhi,1,"This place serves some lip-smacking Indian food at very affordable prices. I would love to mention about the delivery and packaging of the food which was great and order delivered at right time. Would recommend to try the Biryani, Shahi Tukda , Dahi Kebab, Bharwa aloo, kada panner, pakka panner, Dal Makhani.

Must try this place",Handiwala,28.5496860000,77.2122780000
18696895,https://www.zomato.com/ncr/biryani-by-kilo-new-friends-colony-new-delhi,1,"Biryani By Kilo one of the most famous chain for some lip smacking biryani in Delhi & Ncr. I have always been fan of this place, for a huge variety available and authentic flavours. Loved the Mutton Ghost Lucknowi Biryani, perfect taste it was mild spicy tastes perfect with raita. I’m also a fan of the soft Mutton Galouti what they served well Minch meat with mint chutney is just perfect and would love to mention one of the softest and delicious galouti I have had. I also tried panner nawabi with ulte tawa ka paratha was just amazing. Chunks of cottage cheese in creamy tomato gravy ( tried it first time love it). I ended the meal with some Phirni ita just Delicious, never skip while...read more",Biryani By Kilo,28.5610033799,77.2724069282
18678107,https://www.zomato.com/ncr/bistro--hajipur,1,"A good reasonable place in Noida to satisfy your all sorts of cravings. The place is small and cozy but serves some delicious food, with huge variety to choose from. Totally would recommend Chicken Makhani Bruschetta, Baked Cheesy Fries, Alfredo Penne pasta was bang on and loved it. I would highly recommend the wheat Chicken Momos they were so soft and delicious.

A perfect meal was ended with some warm Chocolate and Oreo Mud Cake. Would recommend this place in Noida for quick and tasty snacking options.",Bistro 37,28.5388455654,77.3652650043
18237321,https://www.zomato.com/ncr/echoes-satyaniketan-satyaniketan-new-delhi,1,"Totally love this place for its unique concept. The newly revamped Echoes in Satya Niketan is something you can’t miss. The ambiance and feel of the place is young & Peppy . The prices are pocket friendly. Would recommend the thick shakes, afghani creamy fish, chicken lollipop, and tandoori momos are amazing !

Must try the place with your college buddies",Echoes Satyaniketan,28.5876880521,77.1669089422
3379,https://www.zomato.com/ncr/la-piazza-hyatt-regency-bhikaji-cama-place-delhi,1,"La Piazza is one of the finest italian restaurant in town and it is famous for its some special in-house recipes & imported Italian products. The Restaurant is famous for its delectable wood-fired pizza , homemade pasta, risottos, desserts which will bring you back to the place again and again... The restaurants is serving since last 24 years is one of my favourites in town for Italian cuis The old school ambiance paired with some fine drinks is a perfect spot for all the food lovers.The hospitality at Hyatt has been great always and its a delight to dine in .. The experience is just amazing ! Coming to the food.... minestrone soup and handmade focaccia bread with bell pepper dip...read more",La Piazza - Hyatt Regency,28.5694176923,77.1860599145
18575170,https://www.zomato.com/ncr/asia-central-dlf-phase-4-gurgaon,1,"A pan asian restaurant in town can't be missed. I totally loved the packaging and taste of the food was proper and intact. The delivery was right on time.

The things I tried and recommend are :
1) Thai spring roll ( highly recommend these crispy rolls with an waning filling served with Thai chilli sauce)
2)emperors delights
3)veg Hakka noodles
4) black bean vegetables

It is a place which can't be missed, if you are pan asian food lover.",Asia Central,28.4614461981,77.0867162570
313267,https://www.zomato.com/ncr/for-gods-cake-delhi-university-gtb-nagar-new-delhi,1,"For God’s Cake is one of the best bakeries in North Campus and loved by all college students. The pricing is quite affordable and the variety is huge. The best selling are the beautiful Freak Shakes I ordered for the Unicorn Freak Shake it was not only Gorgeous but tasted also absolutely delicious... I also tried Nutella Mousse Cake, Honey Almond Pastry, Red Velvet Cupcake , Nutella Cupcake...

They have huge range of Cake In Jar and my absolute favourite was Nutella brownie as it can never ever go wrong... Also you will find crispy potato twister steamed up well with refreshing ice tea...

This is the best place to get all your sweet cravings sorted at a very reasonable price.",For God's Cake,28.6951283604,77.2041882947
18662565,https://www.zomato.com/ncr/pomp-pizza-on-my-plate-greater-kailash-gk-1-new-delhi,1,"A Box of Pizza 🍕 & Netflix is what I need to make my boring night turn to an awesome & tasty 😋 night . I tried out POMP: Pizza on my Plate a late night delivery outlet perfect to satisfy your desire for a great meal. The packaging was unusual, the boxes could be easily converted to plates, or convenient storage boxes. The delivery was right on time. Now coming to food, they have a huge range of food and drinks to choose from.. I ordered the Nerds on Mushroom Pizza ( wild mushroom cream, shiitake,button mushroom & Ricotta ) & FarmVille ( Mushrooms, Corn, onions, bell pepper, mozzarella) both the pizza were spectacular. Perfectly baked thin crust pizza with fresh juicy...read more",POMP - Pizza On My Plate,28.5559756728,77.2367187962
307801,https://www.zomato.com/ncr/artusi-ristorante-e-bar-greater-kailash-gk-2-new-delhi,1,"Artusi Ristorante the Italian fine dining restaurant is located in Gk2 M block Market. The restaurant has a courteous staff who make sure that we have a complete fine dine experience, with some authentic Italian dishes & it’s authenticity is to a specific region called Emilia-Romagna with its capital Bologna. The menu is massive, and customisation can be made according to preference. We started with the Tomino ( cheese melted over a toasted bread sautéed mushrooms with a glaze of truffle oil) this was a signature dish and was impressive and should not be missed by vegetarians. We also tried the Ferro salad ( lettuce salad with grapes, raisins, pears , goat cheese , topped with wine...read more",Artusi Ristorante e Bar,28.5333882265,77.2420443222
308741,https://www.zomato.com/ncr/yum-yum-cha-saket-new-delhi,1,"If Zomato allowed more stars for this place then it would have definitely deserved more but yes a full score too yum yum Cha without a doubt its my monthly pilgrimage quiet literally :p visit almost each month and have tried everything on the menu. I would like the mention about few of my favourites what not to miss waise tu everything is awesome just a little favourite. KFC bao. Amongst the dim sum Prawn curry dumpling, prawn Hargao, chicken chilli oil, Bok Choy, chilli cheese, Cantonese veg. In sushi must try ebi tempura, asparagus tempura, crispy cream. Must try the sliced garlic chicke, wonton, spring rolls, corn cakes, aromatic prawns. You can miss green Thai curry with rice...read more",Yum Yum Cha,28.5288151900,77.2197001800
18647454,https://www.zomato.com/ncr/you-mee-greater-kailash-gk-2-new-delhi,1,"The new be in town you me is something you can’t miss if you are seeker for some good pan Asian food.

The place serves a huge variety of scrumptious sushi, dim sum, ramen, noodles, shakes starters, desserts which are just perfect to satisfy your taste buds.

I would recommend you the garden dragon sushi, totally loved the crunch in it and worth a try, New York cheese and chilli oil are also perfect and can’t be missed. Don’t miss out the freak shakes loved the caramel.

All in all one should try out this place.",You Mee,28.5332403607,77.2418736666
1304,https://www.zomato.com/ncr/shekaza-since-1992-chittaranjan-park-new-delhi,1,"Recently ordered food from this place and was highly impressed with the food. The packaging was perfect, and delivered on time.
I just loved everything I ordered the chilli chicken was just bang on, as I mentioned not to make it spicy it was perfect. The shahi planner in creamy gravy was delicious with crispy parathas just loved it. From the Chinese selection we tried the Veg spring roll they were crispy and tasty and loved the sweet n sour veggies with noodles

This place is a must try to get your hunger pangs sorted with yummy food",Shekaza - Since 1992,28.5396808715,77.2524499521
18602568,https://www.zomato.com/ncr/swad-desh-videsh-ka-nehru-place-new-delhi,1,"  SWAD- DESH VIDESH KA,  is a cafe with beautiful ambience .The cafe is located in nehru place, opp. EROS hotel. They have desi food and that too with a videshi (international )flavours.

Must try

 Maggie Manchow Soup – must try this yummy Maggie soup with a man how flavour.Thai crunch Salad - crispy crunchy raw papaya salad with a yummy dressings and topped with peanuts for the crunch. Manglorian fried idli were well done with yummy coconut chutney.
Chat lovers must try the Chit chat Dahi Bhalla and Raj kachori

For mains we ordered Green Thai curry, Dal makhni, Paneer Makhani with breads.
Must try Gulaab phirni, jalebi with Rabri",SWAD - Desh Videsh Ka,28.5497564501,77.2504014149
18653220,https://www.zomato.com/ncr/punjab-grill-khan-market-new-delhi,1,"The chain of restaurants Punjab Grill is a very famous name when it comes to north Indian food, with the newest branch in the posh lanes of khan market. A very fine dine place with very perfect interiors and perfect meal. The place is based on a theme of 'we travelled' and they have put a telephone in one corner of it where you can dial and hear some interesting stories. Their menu here, is vast which have some lip smacking modern twist to the well know classics.   NOW COMING TO THE FOOD; We started with the non veg platter and the seekh keabs were just delicious soft and had great flavours, and in the veg we tried the platter of veg kebabs loved the, Dahi kebabs & Malai Broccoli. I...read more",Punjab Grill,28.5998584825,77.2262501344
307391,https://www.zomato.com/ncr/sugarama-patisserie-shahpur-jat-new-delhi,1,"I tried this very famous bakery of Delhi. I ordered couple of things : 1)TRIPLE CHOCOLATE MOUSSE  2)RASPBERRY CHOCOLATE DOME 3) MACAROONS  4) RASPBERRY & PISTACHIOS 5)  SALTED CARAMEL CHOCOLATE TART  The delivery was right on time and packaging was done quite well. I would start the macaroons I tried the Belgium chocolate, slated caramel, coffee were really tasty will highly recommend the salted caramel & chocolate one. The triple layer cake with sinful layers of White, Dark, Milk Chocolate on bed of brownie sponge was one of the best cakes I have had and would recommend.  In the eggless options loved the raspberry dome with a soft moist filing of chocolate. The raspberry glaze was...read more",Sugarama Patisserie,28.5493191058,77.2148762271
18603777,https://www.zomato.com/ncr/orient-heritage-malviya-nagar-new-delhi,1,"Pan Asian food is one my favorite and love trying out new places all around my place for delivery when I’m lazy to go out for a meal. Orient Heritage is a place I recently tried. The food was delivered on time and was well packed. We had the : 1. CURRY DIMSUMS , Soft steamed chicken dimsum with the peanut based in house sauce was so delicious and yummy that I recommend this to try out for sure. 2. BASIL CHICKEN DIMSUM , The little cuties looked so beautiful and tasted also absolutely perfect & tasty. 3. RED THAI CURRY WITH STEAMED RICE , Thai curry was creamy with a tangy flavor tasted perfectly with steam rice. The flavor was perfect. 4. CRISPY CHICKEN SWEET N SOUR, Classic old...read more",Orient Heritage,28.5354159107,77.2126007080
18429148,https://www.zomato.com/ncr/pa-pa-ya-saket-new-delhi,1,"Went for lunch with friends on a lazy afternoon. The decor is bright and has a very huge comfortable seating area with a beautiful bar right in the Centre. We started with the Sushi boat which had a huge and fulfilling selection of sushi starting from the carbon sushi , tuna , yellowtail, salmon O-nigiri. We also had some soft chicken buns, chili chicken shawarma, rock shrimp tempura and Butayaki !! For the mains, we ordered the 1. wok braised sliced chicken 2. sichuan style crispy prawns 3. Lamb rendang curry with fried rice  4. stir fried noodles   5. Udon noodles. For the desserts we had Liquid hazelnut fondant cake matcha and blueberry quenelle, mochi icecream 4 different...read more",Pa Pa Ya,28.5285368249,77.2184998915
18175291,https://www.zomato.com/ncr/getafix-greater-kailash-gk-1-new-delhi,1,"This place is just perfect for all the guilt free indulgence and it won’t disappoint in aspects of good taste, price and presentation. I happen to have visit this place and I have had an amazing experience, I would highly recommend the berry smoothie bowl, Italian style egg with toast, grilled chicken burger, cold coffee, grilled fish in lemon caper sauce. This is a perfect place for all those who want to eat good but stay healthy & fit !!",Getafix,28.5501130979,77.2352526337
18601702,https://www.zomato.com/ncr/jamun-lodhi-colony-new-delhi,1,"Located in the Lodhi market this place is a small little place serving some flavourful and lip smacking food. This place has beautiful ambiance and interiors with shades of purple ( basically jamun colour) . The place serves some regional food and must try chicken 65, Arbi, panner tikka, mutton ghee toast, butter chicken, keema Naan,Chicken xucatti, mutton rogan josh with some paratha or Naan. To end with you have to try jamun kulfi, soft spongy rasmalai & gulab jamun",Jamun,28.5853516581,77.2230415419
18602050,https://www.zomato.com/ncr/mia-bella-romantic-kitchen-bar-hauz-khas-village-new-delhi,1,"Mia Bella located In HKV is one of the most romantic places I have visited recently. The place has a very beautiful ambiance which can’t be expressed in words, totally breathtaking. This place served some really good food I really liked bell pepper in meat sauce, Bruschetta bar, Wild mushroom risotto was really tasty a must try. One should must try the Tiramisu one of the best tiramisu I have had recently",Mia Bella - Romantic Kitchen & Bar,28.5534633490,77.1941139176
18578057,https://www.zomato.com/ncr/the-cake-company-dlf-phase-1-gurgaon,1,"The cake company is a complete satisfaction to all your sweet cravings!! I have tried the chocolate mousse tub oh my that’s a whole tub of goodness and yummyiness, a tub of Chocolate mousse, is what you need and I’m sure one won’t satisfy your craving hence u would need more because it’s just yummy with chunks of hazelnut and almonds totally yum. I tried the eggless pineapple pastry the classic pastry can never ever go wrong it was soft moist spongy and totally yum. Also you must try the handcrafted chocolates or bars and not to forget the 10 layer cake, A must try place",The Cake Company,28.4730624035,77.0923985168
18535180,https://www.zomato.com/ncr/wood-box-cafe-delhi-university-gtb-nagar,1,"I finally tried WOODBOX CAFE its a outlet located in hudson lane, north campus. The dishes I  tried 

1) Herbivorous plate- the huge plate comes with a variety of dimsums, peri peri fries,chilli potatoes,garlic breads,dragon rolls,burger with 2 dips.The presentation 
was really good.

2) Freak waffles- the giant multiple layered waffle was really great & a must try 

3) Cheesy Nachos : Baked nachos are a must try at Woodbox cafe, its cheesy and best part being they don't get soggy 

overall it was a good place and a must try !.",Wood Box Cafe,28.6950607174,77.2041081637
18376470,https://www.zomato.com/ncr/the-irish-house-nehru-place-new-delhi,1,The Irish house is a fantastic place known for its cocktails & offcourse some great food. Im totally in love with this place,The Irish House,28.5507645440,77.2515504062
18312460,https://www.zomato.com/ncr/dhaba-estd-1986-delhi-nehru-place-new-delhi,1,"One of my favorite places for some good indian food ! The ambiance & interior of the place is just like a road side dhabas on highways!
The place apart from having great interiors serves great food too ! Butter chicken, Malai tikka, galouti kebabs, nalli nihari, maaki roti & sarso ka saag, rasmalai, Gulaab Jasmun, Dhabe ka Neerja , kaala khatta Banta are my fav picks at this place. Must try this place.",Dhaba - Estd 1986 Delhi,28.5516401023,77.2516784817
18395381,https://www.zomato.com/ncr/the-sky-high-khel-gaon-marg-new-delhi,1,"The place is perfect for a romantic date or casual chill with friends. The terrace which is the most attractive thing about the place and it’s so beautiful that I just can’t take off my eyes from the beautiful ambiance.

Coming to food drinks
1) Nachos very well prepared crispy with a proportioned dips added on to it
2) BBQ Fries Crispy Fries topped with cheesy sauce & BBQ sauce
3) Pizza is a must try here it is super delicious and super cheesy, and one of the best thin crust pizza I have had
4) Veg Mezze Platter was decent and can be paired well with some drinks.

All in all place is super for some great fun",The Sky High,28.5623102558,77.2242954746
18265393,https://www.zomato.com/ncr/sana-di-ge-chanakyapuri-new-delhi,1,"SANADIGE is one best example of a great Fine Dine experience in New Delhi. The place is located in heart of Delhi Chankyapuri. The whole ambiance, the look and feel of the whole place is just breathtaking. One will definitely go into a great experience of food & drinks.

Must must have is the Prawns in garlic pepper garlic sauce, Chicken stew, anjal tawa Dry,mutton masala Dry, malabar fish curry, with some Malabar paratha, appam and you can end with some payasam.

Totally a worth try for sea food lovers lovers",Sana-Di-Ge,28.6019175604,77.1870918944
18423151,https://www.zomato.com/TheDarziBar,1,"CP is the place where you will find a lot of places to explore from. Recently only I visited Darzi Bar & Kitchen the whole concept is based on the Darzi ( tailoring and stitching ) the interiors of the place speaks for it very beautifully. I loved the whole ambiance and feel of the place with some huge scissors, threads, sewing machine etc was something which will catch your eye. Now for the food I started with some starters like the very famous Isbt Makhani Maggi, this was a unique Maggi no doubt prepared well in a makhani gravy with some cream on top, I also tried Rum Chicken which was Chicken legs marinated well in some spicy tangy sauce glazed with some rum. I also try the...read more",The Darzi Bar & Kitchen,28.6354464429,77.2189940885
306517,https://www.zomato.com/ncr/the-tummy-section-jail-road-new-delhi,1,This place is a must try if you haven’t !! To be honest I have beard a lot about this place and yes it was amazing I loved the shawarma one of the best I had indeed. The chicken burger was also great & the chicken lollipop is also a tasty. Do try this place !!,The Tummy Section,28.6346707512,77.0970011875
18463567,https://www.zomato.com/ncr/nueva-r-k-puram-new-delhi,1,"The newly opened Nueva is a perfect definition of FINE DINE or DINE IN STYLE. The place has fantastic interiors which are just breath taking, divided in two floors ( dining & bar).

For the food must try Chicken Piri Piri, Cottage Cheese salad ( the cheese is a form a jelly is just cherry on the cake) presentation is fabulous. Chicken Empanadas are just yummy and can’t be missed. Veg Tempura Sushi is awesome.
For mains do try Butter Poached Sole With chili infused sauce & Chicken Breast with Vindaloo sauce. Meal can be ended with some yummy coffee and Parched.",Nueva,28.5726259963,77.1734049171
307490,https://www.zomato.com/ncr/summer-house-cafe-hauz-khas-new-delhi,1,"If you want a good place to chill with friends over some good food and drinks, Summer house should definitely be on the top of your lists !
The place has both indoor and outdoor sitting with light music playing.
Now coming to food and drinks I totally loved the Spring Rolls, Nutella Shake, Alfredo Pasta, Overload Veggies Thin Crust pizza, Overloaded cheese Nachos, classic waffles

This place is a must try !!",Summer House Cafe,28.5524072775,77.2037886456
18558920,https://www.zomato.com/ncr/burma-burma-saket-new-delhi,1,"Burma Burma is the newest baby in town, even though the chain in operating in Ncr. It is a small little cute place located in the mall the ambiance of the place is totally good!!

Now coming to the food it’s a PURE VEGETARIAN restaurant, and being a Non Vegetarian I JUST LOVED THE PLACE !!

Things you can’t miss The raw mango salad, the minch mash with malabar paratha, panfried dumplings, lotus stem with paprika, Tofu & Soya Buns, Samosa Soup, Khow suey, China Noodles, Bubble tea , Hazelnut crunch and coconut gel with Carmel, pineapple & foam

All in all this is a must visit place !!",Burma Burma,28.5284455092,77.2186621651
18537577,https://www.zomato.com/ncr/enoki-fresh-asian-kitchen-greater-kailash-gk-1-new-delhi,1,"For the love of asian food this place is something which can't miss. Some fresh and lip smacking asian food delivered to ur doorstep which will make you delighted with joy. Must have 1) Dragon roll, something similar to spring rolls but assure you better than the regular ones 2) vegetable cantonese Dimsum, soft thin dimsum with yummy and fresh filing was just a party to tastebuds 3) Thai curry with rice was just beautifully done perfect flavors 4) Noodles in teriyaki sauce 5) Chii chicken poke bowl is a version of de construction sushi which is just wonderful and can't be expressed in words how yummy it was 6) Tokyo chicken sushi is also a must try Overall a yummy place to have...read more",Enoki - Fresh Asian Kitchen,28.5569368837,77.2357756644
134,https://www.zomato.com/ncr/moti-mahal-delux-defence-colony-new-delhi,1,"Moti Mahal is known as the Non veg Paradise, known for its some lip smacking Indian curries this food chain is not unknown to the delhities. I recently visited the def col outlet where I had a wonderful experience. From the food and drink to the food everything was beautifully done. The items what I tried and recommend would be the Non veg platter having malai seekh, achari tikka, malai tikka, chicken tikka & Tandoori Chicken. The platter is a yummy and fulfilling starter for 3 people served with some onion and chutney its perfect ! For the mains I had the famous Butter Chicken with Garlic naan, dal makhni & kadai panner, needless to say this combination is an old and classic...read more",Moti Mahal Delux,28.5736939370,77.2300585359
18208886,https://www.zomato.com/ncr/carnatic-cafe-greater-kailash-gk-2-new-delhi,1,"I have always loved south Indian food a lot. Recently I visited this place twice and I had a lovely experience which made me give a full rating. The place is a decent cafe serving some lip smacking south indian dishes.

The best thing is menu is compact and limited but the dishes are just amazingly done !

Must try Neer dosa, onion rava masala, paddu, filter coffee, malleshwaram & mandaki


The staff is very friendly and service is also white good !",Carnatic Cafe,28.5335732057,77.2421609983
